{
  "SchemaVersion": "1.0.0",
  "FixtureId": "tst006-microsoft-native-v1",
  "Sanitized": true,
  "Offline": { "TenantConnectionAllowed": false, "NetworkAllowed": false, "CredentialsRequired": false, "ApplyAllowed": false },
  "Binding": {
    "TenantId": "00000000-0000-4000-8000-000000000006",
    "OrganizationName": "tst006.invalid",
    "DeploymentProfile": "MicrosoftNative",
    "ConfigurationHash": "sha256:6666666666666666666666666666666666666666666666666666666666666666",
    "CollectedAtUtc": "2026-09-19T12:00:00Z"
  },
  "Entitlement": {
    "Determined": true,
    "FullyEntitled": true,
    "EnabledServicePlan": ["EXCHANGE_S_ENTERPRISE", "ATP_ENTERPRISE", "SAFEDOCS", "M365_ADVANCED_AUDITING", "E3_COMPLIANCE"]
  },
  "Controls": [
    {"ControlId":"EXO-001","ApplicableProfile":["Native","Gateway"],"Applicability":{"Determined":true,"Applicable":true,"Reason":"IncludedByMicrosoftNativeProfile"},"Entitlement":{"Determined":true,"Entitled":true,"Prerequisite":["EOP"]},"Collector":"Get-AcceptedDomainEvidence","Evaluator":"Test-AcceptedDomainControl","Evidence":{"ControlId":"EXO-001","TenantId":"00000000-0000-4000-8000-000000000006","DeploymentProfile":"MicrosoftNative","ConfigurationHash":"sha256:6666666666666666666666666666666666666666666666666666666666666666","CollectedAtUtc":"2026-09-19T12:00:00Z","Collected":true,"Source":"SyntheticOffline","Command":"Get-AcceptedDomainEvidence","Value":{"Compliant":true}},"Result":{"ControlId":"EXO-001","Status":"Pass","EvidenceControlId":"EXO-001"}},
    {"ControlId":"EXO-002","ApplicableProfile":["Native","Gateway"],"Applicability":{"Determined":true,"Applicable":true,"Reason":"IncludedByMicrosoftNativeProfile"},"Entitlement":{"Determined":true,"Entitled":true,"Prerequisite":["EOP"]},"Collector":"Get-SmtpAuthenticationEvidence","Evaluator":"Test-SmtpAuthenticationControl","Evidence":{"ControlId":"EXO-002","TenantId":"00000000-0000-4000-8000-000000000006","DeploymentProfile":"MicrosoftNative","ConfigurationHash":"sha256:6666666666666666666666666666666666666666666666666666666666666666","CollectedAtUtc":"2026-09-19T12:00:00Z","Collected":true,"Source":"SyntheticOffline","Command":"Get-SmtpAuthenticationEvidence","Value":{"Compliant":true}},"Result":{"ControlId":"EXO-002","Status":"Pass","EvidenceControlId":"EXO-002"}},
    {"ControlId":"EXO-003","ApplicableProfile":["Native","Gateway"],"Applicability":{"Determined":true,"Applicable":true,"Reason":"IncludedByMicrosoftNativeProfile"},"Entitlement":{"Determined":true,"Entitled":true,"Prerequisite":["EOP"]},"Collector":"Get-ConditionalAccessEvidence","Evaluator":"Test-ConditionalAccessControl","Evidence":{"ControlId":"EXO-003","TenantId":"00000000-0000-4000-8000-000000000006","DeploymentProfile":"MicrosoftNative","ConfigurationHash":"sha256:6666666666666666666666666666666666666666666666666666666666666666","CollectedAtUtc":"2026-09-19T12:00:00Z","Collected":true,"Source":"SyntheticOffline","Command":"Get-ConditionalAccessEvidence","Value":{"Compliant":true}},"Result":{"ControlId":"EXO-003","Status":"Pass","EvidenceControlId":"EXO-003"}},
    {"ControlId":"EXO-004","ApplicableProfile":["Native","Gateway"],"Applicability":{"Determined":true,"Applicable":true,"Reason":"IncludedByMicrosoftNativeProfile"},"Entitlement":{"Determined":true,"Entitled":true,"Prerequisite":["EOP"]},"Collector":"Get-OutboundForwardingEvidence","Evaluator":"Test-OutboundForwardingControl","Evidence":{"ControlId":"EXO-004","TenantId":"00000000-0000-4000-8000-000000000006","DeploymentProfile":"MicrosoftNative","ConfigurationHash":"sha256:6666666666666666666666666666666666666666666666666666666666666666","CollectedAtUtc":"2026-09-19T12:00:00Z","Collected":true,"Source":"SyntheticOffline","Command":"Get-OutboundForwardingEvidence","Value":{"Compliant":true}},"Result":{"ControlId":"EXO-004","Status":"Pass","EvidenceControlId":"EXO-004"}},
    {"ControlId":"EXO-005","ApplicableProfile":["Native","Gateway"],"Applicability":{"Determined":true,"Applicable":true,"Reason":"IncludedByMicrosoftNativeProfile"},"Entitlement":{"Determined":true,"Entitled":true,"Prerequisite":["EOP"]},"Collector":"Get-ExternalPostmasterEvidence","Evaluator":"Test-ExternalPostmasterControl","Evidence":{"ControlId":"EXO-005","TenantId":"00000000-0000-4000-8000-000000000006","DeploymentProfile":"MicrosoftNative","ConfigurationHash":"sha256:6666666666666666666666666666666666666666666666666666666666666666","CollectedAtUtc":"2026-09-19T12:00:00Z","Collected":true,"Source":"SyntheticOffline","Command":"Get-ExternalPostmasterEvidence","Value":{"Compliant":true}},"Result":{"ControlId":"EXO-005","Status":"Pass","EvidenceControlId":"EXO-005"}},
    {"ControlId":"EXO-006","ApplicableProfile":["Native","Gateway"],"Applicability":{"Determined":true,"Applicable":true,"Reason":"IncludedByMicrosoftNativeProfile"},"Entitlement":{"Determined":true,"Entitled":true,"Prerequisite":["EOP"]},"Collector":"Get-MailboxAuditingEvidence","Evaluator":"Test-MailboxAuditingControl","Evidence":{"ControlId":"EXO-006","TenantId":"00000000-0000-4000-8000-000000000006","DeploymentProfile":"MicrosoftNative","ConfigurationHash":"sha256:6666666666666666666666666666666666666666666666666666666666666666","CollectedAtUtc":"2026-09-19T12:00:00Z","Collected":true,"Source":"SyntheticOffline","Command":"Get-MailboxAuditingEvidence","Value":{"Compliant":true}},"Result":{"ControlId":"EXO-006","Status":"Pass","EvidenceControlId":"EXO-006"}},
    {"ControlId":"EXO-007","ApplicableProfile":["Native","Gateway"],"Applicability":{"Determined":true,"Applicable":true,"Reason":"IncludedByMicrosoftNativeProfile"},"Entitlement":{"Determined":true,"Entitled":true,"Prerequisite":["EOP"]},"Collector":"Get-ExternalSenderTagEvidence","Evaluator":"Test-ExternalSenderTagControl","Evidence":{"ControlId":"EXO-007","TenantId":"00000000-0000-4000-8000-000000000006","DeploymentProfile":"MicrosoftNative","ConfigurationHash":"sha256:6666666666666666666666666666666666666666666666666666666666666666","CollectedAtUtc":"2026-09-19T12:00:00Z","Collected":true,"Source":"SyntheticOffline","Command":"Get-ExternalSenderTagEvidence","Value":{"Compliant":true}},"Result":{"ControlId":"EXO-007","Status":"Pass","EvidenceControlId":"EXO-007"}},
    {"ControlId":"EXO-008","ApplicableProfile":["Native","Gateway"],"Applicability":{"Determined":true,"Applicable":true,"Reason":"IncludedByMicrosoftNativeProfile"},"Entitlement":{"Determined":true,"Entitled":true,"Prerequisite":["EOP"]},"Collector":"Get-RemoteDomainEvidence","Evaluator":"Test-RemoteDomainControl","Evidence":{"ControlId":"EXO-008","TenantId":"00000000-0000-4000-8000-000000000006","DeploymentProfile":"MicrosoftNative","ConfigurationHash":"sha256:6666666666666666666666666666666666666666666666666666666666666666","CollectedAtUtc":"2026-09-19T12:00:00Z","Collected":true,"Source":"SyntheticOffline","Command":"Get-RemoteDomainEvidence","Value":{"Compliant":true}},"Result":{"ControlId":"EXO-008","Status":"Pass","EvidenceControlId":"EXO-008"}},
    {"ControlId":"EXO-009","ApplicableProfile":["Native","Gateway"],"Applicability":{"Determined":true,"Applicable":true,"Reason":"IncludedByMicrosoftNativeProfile"},"Entitlement":{"Determined":true,"Entitled":true,"Prerequisite":["EOP"]},"Collector":"Get-ClientProtocolEvidence","Evaluator":"Test-ClientProtocolControl","Evidence":{"ControlId":"EXO-009","TenantId":"00000000-0000-4000-8000-000000000006","DeploymentProfile":"MicrosoftNative","ConfigurationHash":"sha256:6666666666666666666666666666666666666666666666666666666666666666","CollectedAtUtc":"2026-09-19T12:00:00Z","Collected":true,"Source":"SyntheticOffline","Command":"Get-ClientProtocolEvidence","Value":{"Compliant":true}},"Result":{"ControlId":"EXO-009","Status":"Pass","EvidenceControlId":"EXO-009"}},
    {"ControlId":"EXO-010","ApplicableProfile":["Native","Gateway"],"Applicability":{"Determined":true,"Applicable":true,"Reason":"IncludedByMicrosoftNativeProfile"},"Entitlement":{"Determined":true,"Entitled":true,"Prerequisite":["EOP"]},"Collector":"Get-ExchangeRoleAssignmentEvidence","Evaluator":"Test-ExchangeRoleAssignmentControl","Evidence":{"ControlId":"EXO-010","TenantId":"00000000-0000-4000-8000-000000000006","DeploymentProfile":"MicrosoftNative","ConfigurationHash":"sha256:6666666666666666666666666666666666666666666666666666666666666666","CollectedAtUtc":"2026-09-19T12:00:00Z","Collected":true,"Source":"SyntheticOffline","Command":"Get-ExchangeRoleAssignmentEvidence","Value":{"Compliant":true}},"Result":{"ControlId":"EXO-010","Status":"Pass","EvidenceControlId":"EXO-010"}},
    {"ControlId":"EXO-011","ApplicableProfile":["Native","Gateway"],"Applicability":{"Determined":true,"Applicable":true,"Reason":"IncludedByMicrosoftNativeProfile"},"Entitlement":{"Determined":true,"Entitled":true,"Prerequisite":["EOP"]},"Collector":"Get-MtaStsEvidence","Evaluator":"Test-MtaStsControl","Evidence":{"ControlId":"EXO-011","TenantId":"00000000-0000-4000-8000-000000000006","DeploymentProfile":"MicrosoftNative","ConfigurationHash":"sha256:6666666666666666666666666666666666666666666666666666666666666666","CollectedAtUtc":"2026-09-19T12:00:00Z","Collected":true,"Source":"SyntheticOffline","Command":"Get-MtaStsEvidence","Value":{"Compliant":true}},"Result":{"ControlId":"EXO-011","Status":"Pass","EvidenceControlId":"EXO-011"}},